name,short_name,type,valid_until,description,administering_agencies,supportable_activities,benefits,eligibility_criteria,target_audiences,outcomes,business_needs,link,error
Enterprise Development Grant,EDG,Grant (financial),31 March 2026,"The Enterprise Development Grant (EDG) supports projects that help Singapore companies upgrade, innovate, grow, and transform their business. It funds qualifying project costs such as third-party consultancy fees, software and equipment, and internal manpower cost. The grant supports projects under three categories: Core Capabilities, Innovation & Productivity, and Market Access. It aims to help businesses improve their business foundations, adopt technology and innovative processes, and expand their overseas presence.",['Enterprise Singapore'],"Projects that help upgrade business, innovate, or venture overseas, including business strategy development, financial management, human capital development, service excellence, strategic brand and marketing development, automation, process redesign, product development, pilot project and test bedding, and standards adoption.","Up to 50% of eligible costs for local SMEs, with sustainability-related projects supported at up to 70% from 1 April 2023 to 31 March 2026.","Business entity registered and operating in Singapore, with at least 30% local equity held directly or indirectly by Singaporean(s) and/or Singapore PR(s). The company must be financially ready to start and complete the project.","['Singapore companies', 'SMEs']","['Core Business Capability Development', 'Innovation Project', 'Technology Adoption', 'Market Expansion']","['Business Transformation', 'Operational Efficiency', 'Market Expansion', 'Corporate Innovation', 'Capability Investment']",https://www.enterprisesg.gov.sg/financial-support/enterprise-development-grant,False
SMEs Go Digital,SGD,Programme (non-financial),,"IMDA's SMEs Go Digital programme empowers businesses to leverage opportunities brought forth by digitalisation, through programmes that aid in integrating tech and strengthening digital foundations. It aims to build a vibrant digital economy and an inclusive digital society, ensuring a safe and inclusive digital environment for all Singaporeans.",['Infocomm Media Development Authority (IMDA)'],"Digital transformation, tech integration, digital foundation strengthening",,,"['Business Owners', 'Managers', 'Consultants', 'Students', 'Professionals', 'Public', 'Seniors']","['Technology Adoption', 'Core Business Capability Development', 'Training and Development']","['Operational Efficiency', 'Capability Investment', 'Business Transformation']",https://www.imda.gov.sg/how-we-can-help/smes-go-digital,False
Growth and Transformation Scheme,GTS,Grant (financial),31 March 2025,"The Growth and Transformation Scheme (GTS) is designed to encourage and support the formation of strategic alliances among developers, consultants, builders, and sub-contractors across the entire value chain in the Built Environment sector. It aims to enable companies to take a longer-term view on business and workforce transformation, strengthening technical capabilities, and enhancing corporate, digital, and innovation practices. The scheme supports strategic collaboration, human capital development, productivity improvements, digitalisation, and sustainability initiatives.",['Building and Construction Authority'],"Strategic collaboration, human capital development, productivity improvements, digitalisation, sustainability initiatives","The grant supports up to 70% of qualifying costs on a reimbursement basis, including equipment, materials, software, testing and accreditation, licensing royalties for technology acquisition, intellectual property rights, training/course fees, and consultancies.","Applicants must be registered business entities in Singapore, have undertaken and/or completed construction projects in Singapore in the past three years, including projects adopting DfMA, IDD, and/or Green Buildings. Developers and Contractors should have a pipeline of projects within the 3-5 year transformation plan. The alliance must involve other SME stakeholders and be led by a Developer with its value chain partners.","['Developers', 'Consultants', 'Builders', 'Sub-contractors', 'SMEs in the Built Environment sector']","['Sectoral Impact', 'Innovation Project', 'Technology Adoption', 'Core Business Capability Development', 'Training and Development']","['Corporate Innovation', 'Operational Efficiency', 'Business Transformation', 'Capability Investment']",https://www1.bca.gov.sg/buildsg/buildsg-transformation-fund/growth-and-transformation-scheme,False
Productivity Solutions Grant,PSG,Grant (financial),,The Productivity Solutions Grant (PSG) helps Singapore companies improve their productivity and automate existing processes through IT solutions and equipment. It supports sector-specific and generic solutions that are pre-approved by EnterpriseSG and other participating agencies.,['Enterprise Singapore'],IT solutions and equipment to improve business productivity,"Up to 50% of eligible costs for local SMEs, with a cap of $30,000.","Business entity is registered and operating in Singapore. Company has at least 30% local equity held directly or indirectly by Singaporean(s) and/or Singapore PR(s). Group annual sales turnover not exceeding S$100 million OR group employment size not exceeding 200 employees. IT solutions or equipment must be used in Singapore. Grant applicant must not have made payment, and/or any form of deposits prior to application submission. Charities, Institutions of Public Characters (IPCs), Religious Entities, Voluntary Welfare Organisation (VWO), Government agencies and subsidiaries, and societies are not eligible.",['Local SMEs'],"['Technology Adoption', 'Operational Efficiency']","['Operational Efficiency', 'Cost Management']",https://www.enterprisesg.gov.sg/financial-support/productivity-solutions-grant,False
SG Cyber Talent Development Fund,SGCTDF,Grant (financial),,"To support communities, associations and industry partners to develop new ground-up initiatives, sustain existing meaningful initiatives, and scale impactful initiatives that aim to engage, build and advance the cybersecurity workforce and ecosystem.",['Cyber Security Agency of Singapore'],"Develop new ground-up initiatives, sustain existing meaningful initiatives, scale impactful initiatives","The fund will support 80% of supportable costs or the funding quantum specified for the project tier (whichever lower). Supportable costs include training materials, cost of trainer/staff, marketing and publicity, cost of software/platform during event period, venue rental, refreshments.","Organisations registered in Singapore. Pre-Tertiary and Tertiary Institutions. Individuals above the age of 18. For communities that are not registered, a representative can apply as an individual. However, they will not be able to apply for Tier 3 projects. For individuals below the age of 18, they can apply for the fund through their respective educational institutions or teachers-in-charge.","['Communities', 'Associations', 'Industry partners', 'Pre-Tertiary and Tertiary Institutions', 'Individuals above the age of 18']","['Training and Development', 'Innovation Project']",['Capability Investment'],https://www.sgsocialsupport.com/resource/4KwjxJ5Sfxy,False
Technology for Enterprise Capability Upgrading,T-Up,Programme (non-financial),,"The Technology for Enterprise Capability Upgrading (T-Up) programme supports local SMEs and LLEs in enhancing business competitiveness by providing access to researchers, scientists, and engineers to enhance products and technologies. It offers up to 70% support of allowable costs for SMEs or startups, and up to 30% for LLEs, capped at S$250,000 per project. The programme aims to build R&D capabilities, facilitate technology transfer, and support overseas research projects.","['A*STAR', 'AI Singapore']","R&D or innovation projects, technology transfer, overseas research projects","Up to 70% support of allowable costs for SMEs or startups, up to 30% for LLEs, capped at S$250,000 per project. Funding includes overseas costs such as living allowances and airfare.","Business entity registered or incorporated in Singapore, at least 30% local equity held by Singaporean(s) or Singapore PR(s), able to finance and complete the project, Group Annual Sales Turnover not exceeding S$100 million, or Group employment size not exceeding 200 employees.","['Local SMEs', 'Large Local Enterprises (LLEs)']","['Innovation Project', 'Technology Adoption', 'Core Business Capability Development']","['Corporate Innovation', 'Capability Investment']",https://www.enterprisesg.gov.sg/grow-your-business/innovate-with-us/innovation-talent/technology-for-enterprise-capability-upgrading,False
Advanced Digital Solutions,ADS,Programme (non-financial),,"IMDA empowers businesses to leverage opportunities brought forth by digitalisation, through programmes that aid in integrating tech and strengthening digital foundations. The focus is on building a vibrant digital economy and an inclusive digital society, ensuring a safe and inclusive digital environment for all Singaporeans.",['Infocomm Media Development Authority (IMDA)'],"Digital transformation, tech integration, digital foundation strengthening",,,"['Businesses', 'Business Owners', 'Managers', 'Consultants', 'Students', 'Professionals', 'Public', 'Seniors']","['Technology Adoption', 'Core Business Capability Development', 'Training and Development']","['Operational Efficiency', 'Capability Investment']",https://www.imda.gov.sg/how-we-can-help/smes-go-digital/advanced-digital-solutions,False
